magasinier / magasinière cariste,CAP Opérateur/opératrice logistique
magistrat / magistrate,Formation des magistrats
maître / maîtresse d'hôtel,"BTS Hôtellerie-restauration option B art culinaire, art de la table et du service"
manager de risques,Mastère spé. Eco-conception et maîtrise des risques
manager de risques,Mastère spé. Management des risques
manager de risques,Mastère spé. Systèmes d'information pour les entreprises
manager de risques,"Responsable qualité, environnement, sécurité"
manager de risques,Magistère Economie et finance internationales
manager de risques,Master banque et affaires internationales spécialité management des risques financiers
manager de risques,Master finance
manager de risques,Master finance et affaires internationales spécialité gestion des risques et clientèle entreprise
manager de risques,"Master mathématiques et applications spécialité ingénierie statistique et informatique de la finance, de l'assurance et du risque"
manager de risques,"Master pro ingénierie chimique et biologique spécialité gestion des risques santé/sécurité, environnement"
manager de risques,Master pro ingénierie économique et statistique spécialité ingénierie économique
manipulateur / manipulatrice en électroradiologie médicale,Diplôme d'Etat de manipulateur d'électroradiologie médicale
manipulateur / manipulatrice en électroradiologie médicale,DTS Imagerie médicale et radiologie thérapeutique
maquettiste,DNA Diplôme national d'art option communication
maquettiste,DNA Diplôme national d'art option design
maquettiste,BTS Communication et industries graphiques option A étude et réalisation de produits graphiques
maquettiste,BTS Communication et industries graphiques option B étude et réalisation de produits imprimés
maquettiste,BTS Design graphique option communication et médias imprimés
maquettiste,BTS Design graphique option communication et médias numériques
maquettiste,Infographiste multimédia (ESMI)
maquettiste,Infographiste multimédia (ITECOM)
maquettiste,DSAA Design mention graphisme
maquettiste,Diplôme national supérieur des arts décoratifs (ENSAD)
maquettiste,Directeur artistique en art graphique et design numérique
maquettiste,Directeur artistique en communication visuelle et multimédia
maquettiste,DNSEP Diplôme national supérieur d'expression plastique option communication
maquettiste,DNSEP Diplôme national supérieur d'expression plastique option design
maquilleur / maquilleuse artistique,Maquillage artistique professionnel et coiffure studio
maquilleur / maquilleuse artistique,Maquillage artistique professionnel
maquilleur / maquilleuse artistique,Maquilleur artistique
maquilleur / maquilleuse artistique,Maquillage artistique professionnel et coiffure pour le spectacle
maraîcher / maraîchère,BPA Travaux des productions horticoles
maraîcher / maraîchère,CAP agricole Métiers de l'agriculture
maraîcher / maraîchère,BTSA Production horticole
marchandiseur / marchandiseuse,FCIL Négociateur marchandiseur
marchandiseur / marchandiseuse,"Licence pro commerce spécialité commerce, distribution"
marchandiseur / marchandiseuse,Licence pro commerce spécialité commerce et distribution
marchandiseur / marchandiseuse,Licence pro commerce spécialité distribution
marchandiseur / marchandiseuse,Licence pro commerce spécialité distribution : management de rayon
marchandiseur / marchandiseuse,"Licence pro commerce spécialité distribution, management et gestion de rayon"
marchandiseur / marchandiseuse,"Licence pro commerce spécialité distribution, management et gestion de rayon, grandes surfaces"
marchandiseur / marchandiseuse,Visuel Merchandiser
marchandiseur / marchandiseuse,BTS Management des unités commerciales
marchandiseur / marchandiseuse,Décorateur merchandiser
marchandiseur / marchandiseuse,DUT Techniques de commercialisation
marchandiseur / marchandiseuse,Diplôme de l'Institut international du commerce et du développement
marchandiseur / marchandiseuse,"Diplôme de l'Institut supérieur des sciences, techniques et économie commerciales"
marchandiseur / marchandiseuse,Master pro marketing et vente spécialité marketing et commercialisation des produits de grande consommation
maréchal-ferrant / maréchale-ferrante,CAP agricole Maréchal-ferrant
maroquinier / maroquinière,CAP Maroquinerie
maroquinier / maroquinière,CAP Sellerie générale
maroquinier / maroquinière,CAP Sellier harnacheur
maroquinier / maroquinière,BTS Métiers de la mode - chaussure et maroquinerie
masseur / masseuse-kinésithérapeute,Diplôme d'Etat de masseur kinésithérapeute
matelot de la marine marchande,CAP Matelot (maritime)
mécanicien / mécanicienne bateaux,Officier chef de quart machine / chef 8000 kW
mécanicien / mécanicienne bateaux,Agent de maintenance nautique
mécanicien / mécanicienne bateaux,"CAP Développement option 5 gestion et entretien en milieu marin (Polynésie française, Nouvelle-Calédonie)"
mécanicien / mécanicienne bateaux,CAP Réparation entretien des embarcations de plaisance
mécanicien / mécanicienne bateaux,FCIL Marine nationale : mécanique
mécanicien / mécanicienne bateaux,BTS Construction navale
mécanicien / mécanicienne bateaux,FCIL Maintenance navale en milieu subaquatique
mécanicien / mécanicienne bateaux,FCIL Mécanicien réparateur de moteurs marins
mécanicien / mécanicienne d'entretien d'avion,Licence pro maintenance et technologie : organisation de la maintenance
mécanicien / mécanicienne d'entretien d'avion,Licence pro maintenance et technologie : systèmes pluritechniques
mécanicien / mécanicienne d'entretien d'avion,Licence pro métiers de l'industrie : industrie aéronautique
mécanicien / mécanicienne d'entretien d'avion,CAP Aéronautique option avionique
mécanicien / mécanicienne d'entretien d'avion,CAP Aéronautique option structure
mécanicien / mécanicienne d'entretien d'avion,CAP Aéronautique option systèmes
mécanicien / mécanicienne d'entretien d'avion,BTS Aéronautique
mécanicien / mécanicienne d'entretien d'avion,MC Aéronautique option avionique
mécanicien / mécanicienne d'entretien d'avion,MC Aéronautique option avions à moteurs à pistons
mécanicien / mécanicienne d'entretien d'avion,MC Aéronautique option avions à moteurs à turbines
mécanicien / mécanicienne et technicien / technicienne moto,CAP Maintenance des véhicules option motocycles
mécanicien / mécanicienne et technicien / technicienne moto,BTS Maintenance des véhicules option motocycles
mécanicien / mécanicienne et technicien / technicienne moto,FCIL Maintenance des cycles électriques
mécanicien / mécanicienne et technicien / technicienne moto,FCIL Mécanicien moto de compétition (niveau IV)
mécanicien / mécanicienne et technicien / technicienne moto,FCIL Préparation des motocycles de compétition (niveau IV)
mécanicien-outilleur / mécanicienne-outilleuse,CAP Outillages en moules métalliques
mécanicien-outilleur / mécanicienne-outilleuse,MC Maquettes et prototypes
mécanicien-réparateur / mécanicienne-réparatrice en matériel agricole,CAP Maintenance des matériels option A matériels agricoles
mécanicien-réparateur / mécanicienne-réparatrice en matériel agricole,CAP Maintenance des matériels option C matériels d'espaces verts
mécanicien-réparateur / mécanicienne-réparatrice en matériel agricole,CS Tracteurs et machines agricoles utilisation et maintenance
mécanicien-réparateur / mécanicienne-réparatrice en matériel agricole,BTS Techniques et services en matériels agricoles
mécanicien-réparateur / mécanicienne-réparatrice en matériel agricole,BTSA Génie des équipements agricoles
mécanicien-réparateur / mécanicienne-réparatrice en matériel agricole,BTSA Gestion forestière
mécanicien-réparateur / mécanicienne-réparatrice en matériel agricole,MC Maintenance des installations oléohydrauliques et pneumatiques
mécatronicien / mécatronicienne,"Licence pro métiers de l'industrie : mécatronique, robotique"
mécatronicien / mécatronicienne,Diplôme d'ingénieur de l'Ecole nationale supérieure d'ingénieurs de Bretagne-Sud de l'université de Bretagne-Sud spécialité mécatronique
mécatronicien / mécatronicienne,Diplôme d'ingénieur de l'Ecole nationale supérieure d'ingénieurs de Limoges de l'université de Limoges spécialité mécatronique
mécatronicien / mécatronicienne,"Diplôme d'ingénieur de l'Ecole nationale supérieure d'ingénieurs en informatique, automatique, mécanique, énergétique et électronique de l'université de Valenciennes spécialité mécatronique"
mécatronicien / mécatronicienne,Diplôme d'ingénieur de l'Institut des sciences et techniques des Yvelines de l'université de Versailles Saint-Quentin en Yvelines spécialité mécatronique en partenariat avec Ingénieurs 2000
mécatronicien / mécatronicienne,Diplôme d'ingénieur de l'Institut national des sciences appliquées de Strasbourg spécialité mécatronique
mécatronicien / mécatronicienne,Diplôme d'ingénieur du CNAM spécialité mécatronique en convention avec l'université de Poitiers
mécatronicien / mécatronicienne,"Master automatique, robotique"
mécatronicien / mécatronicienne,"Master électronique, énergie électrique, automatique"
mécatronicien / mécatronicienne,Master génie mécanique
mécatronicien / mécatronicienne,Master mécanique
médecin de secours en montagne,Diplôme d'Etat de docteur en médecine
médecin généraliste,Diplôme d'Etat de docteur en médecine
médecin humanitaire,Diplôme d'Etat de docteur en médecine
médecin spécialiste,Diplôme d'Etat de docteur en médecine
médiateur / médiatrice scientifique,Licence chimie
médiateur / médiatrice scientifique,Licence informatique
médiateur / médiatrice scientifique,Licence mécanique
médiateur / médiatrice scientifique,Licence physique
médiateur / médiatrice scientifique,"Licence physique, chimie"
médiateur / médiatrice scientifique,Licence sciences de la vie
médiateur / médiatrice scientifique,Licence sciences de la vie et de la terre
médiateur / médiatrice scientifique,Licence sciences pour l'ingénieur
médiateur / médiatrice scientifique,Licence pro métiers de la médiation scientifique et technique
médiateur / médiatrice scientifique,Master chimie
médiateur / médiatrice scientifique,Master information et médiation scientifique et technique
médiateur / médiatrice scientifique,Master mathématiques
médiateur / médiatrice scientifique,Master mathématiques et applications
médiateur / médiatrice scientifique,Master physique
médiateur / médiatrice scientifique,Master physique fondamentale et applications
médiateur / médiatrice scientifique,"Master sciences de la Terre et des planètes, environnement"
médiateur familial / médiatrice familiale,Diplôme d'Etat de médiateur familial
menuisier / menuisière,BCP Menuisier-agenceur
menuisier / menuisière,CAP Arts du bois option marqueteur
menuisier / menuisière,CAP Arts du bois option sculpteur ornemaniste
menuisier / menuisière,CAP Arts du bois option tourneur
menuisier / menuisière,"CAP Développement option 2 construction et entretien des bâtiments (Polynésie française, Nouvelle-Calédonie, Mayotte)"
menuisier / menuisière,CAP Menuisier aluminium-verre
menuisier / menuisière,CAP Menuisier en sièges
menuisier / menuisière,"CAP Menuisier fabricant de menuiserie, mobilier et agencement"
menuisier / menuisière,CAP Menuisier installateur
menuisier / menuisière,MC Parqueteur
météorologiste,Diplôme d'ingénieur de l'Ecole nationale de la météorologie
metteur / metteuse en scène,Diplôme de mise en scène - dramaturgie (ESAD Strasbourg)
metteur / metteuse en scène,Diplôme national supérieur professionnel de comédien
metteur / metteuse en scène,Licence pro activités culturelles et artistiques spécialité encadrement d'ateliers de pratiques théâtrales
metteur / metteuse en scène,Diplôme arts et techniques du théâtre parcours metteur en scène
metteur / metteuse en scène,Master arts du spectacle et audiovisuel spécialité arts de la scène
microbiologiste,Diplôme d'ingénieur de l'Ecole polytechnique de l'université de Nice spécialité génie biologique
microbiologiste,Diplôme d'ingénieur de l'Ecole supérieure de biotechnologie de Strasbourg de l'université de Strasbourg
microbiologiste,Diplôme d'ingénieur de l'Institut national des sciences appliquées de Toulouse spécialité génie biochimique
microbiologiste,Diplôme d'ingénieur de l'université de technologie de Compiègne spécialité génie biologique
microbiologiste,Diplôme d'ingénieur du Centre universitaire des sciences et techniques de l'université Clermont Ferrand II spécialité génie biologique
microbiologiste,"Master biologie et environnement spécialité microbiologie : génome, écologie et biotechnologies"
microbiologiste,Master biologie moléculaire et cellulaire spécialité microbiologie
microbiologiste,"Master biologie, santé, sciences du médicament spécialité génie physiologique biotechnologique et informatique"
microbiologiste,"Master biologie, santé, sciences du médicament spécialité recherche et ingénierie en biosanté"
microbiologiste,"Master biosciences et ingénierie de la santé spécialité biotechnologies moléculaires et bioingénierie, physiopathologie et thérapeutique"
microbiologiste,Master biosciences spécialité microbiologie
microbiologiste,Master biotechnologies
microbiologiste,Master biotechnologies microbiologie aliment nutrition environnement spécialité biotechnologies microbiennes
microbiologiste,"Master écosciences, microbiologie spécialité microbiologie"
microbiologiste,Master sciences du médicament spécialité assurance qualité microbiologique des produits de santé
microbiologiste,Master rech. aliments et bioproduits spécialité microbiologie appliquée et génie biologique
microbiologiste,Master rech. biologie et santé spécialité microbiologie fondamentale et appliquée
microbiologiste,"Master rech. chimie spécialité biomolécules, catalyse et environnement"
microbiologiste,"Master rech. infectiologie : microbiologie, virologie, immunologie spécialité microbiologie"
microbiologiste,"Master rech. infectiologie : microbiologie, virologie, immunologie spécialité virologie"
microbiologiste,"Master rech. microbiologie, agrobiosciences, biologie des systèmes spécialité microbiologie"
microtechnicien / microtechnicienne,BTS Conception et industrialisation en microtechniques
microtechnicien / microtechnicienne,DUT Génie mécanique et productique
microtechnicien / microtechnicienne,Diplôme d'ingénieur de l'Ecole nationale supérieure de mécanique et des microtechniques
mixeur / mixeuse son,Licence pro techniques du son et de l'image
mixeur / mixeuse son,Licence pro techniques et activités de l'image et du son spécialité réalisation audiovisuelle et design sonore
mixeur / mixeuse son,BTS Métiers de l'audiovisuel option métiers du son
mixeur / mixeuse son,Diplôme de l'Ecole nationale supérieure des métiers de l'image et du son (FEMIS) spécialisation son
mixeur / mixeuse son,Diplôme de l'Ecole nationale supérieure Louis Lumière section son
mixeur / mixeuse son,Diplôme supérieur des métiers du son du CNSMD de Paris
mixeur / mixeuse son,Master pro image et son spécialité image et son
modéliste,Certificat de spécialisation en mode stylisme-modélisme
modéliste,Stylisme infographie modélisme
modéliste,Styliste modéliste
modéliste,"Styliste, modéliste, designer textile"
modéliste,Styliste option modélisme
modéliste,BTS Métiers de la mode - vêtements
modéliste,"Diplôme d'enseignement supérieur privé en stylisme, création textile, modélisme"
modéliste,Modéliste en prêt-à-porter femme
modéliste,Styliste-modéliste
modiste,CAP Métiers de la mode : chapelier-modiste
modiste,FCIL Mode et accessoires
modiste,"BTS Design de mode, textile et environnement option mode"
moniteur / monitrice de ski,"Formation qualifiante concertée, métiers sportifs de montagne et de pleine nature"
moniteur / monitrice de ski,Diplôme d'Etat de ski - moniteur national de ski alpin
monteur / monteuse en installations thermiques et climatiques,CAP Installateur thermique
monteur / monteuse en installations thermiques et climatiques,"Installateur en chauffage, climatisation, sanitaire et énergies renouvelables"
monteur / monteuse en installations thermiques et climatiques,MC Maintenance en équipement thermique individuel
monteur / monteuse en réseaux de distribution électrique,MC Technicien(ne) en réseaux électriques
monteur-câbleur / monteuse-câbleuse,Responsable de chantier en installation électrique
mouleur-noyauteur / mouleuse-noyauteuse,CAP Mouleur noyauteur : cuivre et bronze
mouleur-noyauteur / mouleuse-noyauteuse,CAP Outillages en moules métalliques
mouleur-noyauteur / mouleuse-noyauteuse,BTS Fonderie
musicien / musicienne,Diplôme national supérieur professionnel de musicien
musicien / musicienne,Diplôme d'Etat de professeur de musique
musicien / musicienne,DU Musicien intervenant
musicien / musicienne,Diplôme de 2nd cycle supérieur de musique du CNSMD de Paris
neurobiologiste,"Master biologie, santé, sciences du médicament spécialité recherche et ingénierie en biosanté"
nivoculteur / nivocultrice,BTS Maintenance des systèmes option B systèmes énergétiques et fluidiques
nivoculteur / nivocultrice,BTS Systèmes numériques option B électronique et communications
nivoculteur / nivocultrice,DUT Génie industriel et maintenance
notaire,Diplôme de notaire
notaire,Diplôme supérieur du notariat
océanologue,Bachelor océanographe - prospecteur
océanologue,Diplôme d'ingénieur de l'Ecole nationale supérieure de techniques avancées
océanologue,Master chimie de l'environnement marin spécialité chimie de l'environnement marin
océanologue,Master géosciences spécialité géosciences
océanologue,Master physique et sciences pour l'ingénieur spécialité vision commande
océanologue,Master physique marine spécialité géophysique marine
océanologue,Master physique marine spécialité physique de l'océan et climat
océanologue,"Master sciences de l'univers, environnement, écologie spécialité océan, atmosphère, climat et observations spatiales"
océanologue,"Master sciences de l'univers, environnement, écologie spécialité océanographie et environnements marins"
océanologue,Master pro océanographie spécialité environnement marin
océanologue,Master rech. océanographie spécialité biologie et écologie marines
océanologue,Master rech. océanographie spécialité océanographie physique et biogéochimique
océanologue,"Master rech. sciences de la planète et de l'environnement spécialité océan, atmosphère et surfaces continentales"
océanologue,"Master rech. sciences de la Terre et de l'environnement spécialité eau, climat, environnement"
oenologue,Diplôme national d'oenologue
officier / officière de gendarmerie,Formation d'officier de la gendarmerie nationale
officier / officière de gendarmerie,Préparation à l'entrée en formation d'officier de gendarmerie
officier / officière de la marine marchande,Diplôme d'études supérieures de la marine marchande
officier / officière de la marine marchande,Diplôme d'ingénieur de l'Ecole nationale supérieure maritime
officier / officière de police,Formation d'officier de police
opérateur / opératrice de raffinerie,BTS Conception et réalisation de systèmes automatiques
opérateur / opératrice de raffinerie,BTS Métiers de la chimie
opérateur / opératrice de raffinerie,DUT Chimie option chimie analytique et de synthèse
opérateur / opératrice de raffinerie,DUT Génie thermique et énergie
opérateur / opératrice de raffinerie,DUT Mesures physiques
opérateur / opératrice prépresse,"Licence pro gestion de la production industrielle spécialité flux numériques, édition et production d'imprimés"
opérateur / opératrice prépresse,Licence pro métiers de l'édition spécialité ingénierie et management de projets en communication et industries graphiques
opérateur / opératrice prépresse,Licence pro métiers de l'édition spécialité intégrateur et gestionnaire de flux numériques pour les industries graphiques
opérateur / opératrice prépresse,BTS Communication et industries graphiques option A étude et réalisation de produits graphiques
opérateur / opératrice sur machine à commande numérique,Licence pro métiers de l'industrie : conception de produits industriels
opérateur / opératrice sur machine à commande numérique,Licence pro métiers de l'industrie : conception et amélioration de processus et procédés industriels
opérateur / opératrice sur machine à commande numérique,Licence pro métiers de l'industrie : conception et processus de mise en forme des matériaux
opérateur / opératrice sur machine à commande numérique,Chargé de maintenance des systèmes numériques industriels
opérateur / opératrice sur machine à commande numérique,DUT Génie mécanique et productique
opérateur et technicien / opératrice et technicienne en traitement des matériaux,BTS Fonderie
opérateur et technicien / opératrice et technicienne en traitement des matériaux,BTS Physico-métallographe de laboratoire
opérateur et technicien / opératrice et technicienne en traitement des matériaux,BTS Traitement des matériaux option A traitements thermiques
opérateur et technicien / opératrice et technicienne en traitement des matériaux,BTS Traitement des matériaux option B traitements de surfaces
opérateur et technicien / opératrice et technicienne en traitement des matériaux,DUT Chimie option chimie des matériaux
opérateur et technicien / opératrice et technicienne en traitement des matériaux,DUT Science et génie des matériaux
opticien-lunetier / opticienne-lunetière,BTS Opticien lunetier
optronicien / optronicienne,Diplôme d'ingénieur de l'Ecole nationale supérieure de sciences appliquées et de technologie de Lannion de l'université Rennes 1 spécialité optronique
optronicien / optronicienne,Diplôme d'ingénieur de l'Ecole polytechnique de l'université Paris XI spécialité photonique
optronicien / optronicienne,Diplôme d'ingénieur de l'Ecole polytechnique de l'université Paris XI spécialité photonique en partenariat avec l'ITII Ile de France
optronicien / optronicienne,"Master optique, image, vision, multimédia"
orfèvre,CAP Orfèvre option A monteur en orfèvrerie
orfèvre,CAP Orfèvre option B tourneur repousseur en orfèvrerie
orfèvre,CAP Orfèvre option C polisseur aviveur en orfèvrerie
orfèvre,CAP Orfèvre option D planeur en orfèvrerie
orfèvre,DMA Décor architectural option métal
orthophoniste,Certificat de capacité d'orthophoniste
orthoprothésiste,BTS Prothésiste-orthésiste
orthoprothésiste,CAP Orthoprothésiste
orthoptiste,Certificat de capacité d'orthoptiste
ostéopathe,Diplôme d'ostéopathe
ouvrier / ouvrière agricole,CAP agricole Agricultures des régions chaudes
ouvrier / ouvrière agricole,CAP agricole Métiers de l'agriculture
ouvrier / ouvrière paysagiste,BPA Travaux des aménagements paysagers
ouvrier / ouvrière paysagiste,CAP agricole Entretien de l'espace rural (dernière session d'examen en 2018)
ouvrier / ouvrière paysagiste,CAP agricole Jardinier paysagiste
ouvrier / ouvrière paysagiste,CAP agricole Métiers de l'agriculture
ouvrier forestier / ouvrière forestière,BPA Travaux forestiers
ouvrier forestier / ouvrière forestière,CAP agricole Travaux forestiers
paléontologue,"Master sciences de la Terre et des planètes, environnement"
parfumeur / parfumeuse,Master chimie
parfumeur / parfumeuse,"Master chimie spécialité arômes, parfums, cosmétiques"
parfumeur / parfumeuse,Master pro chimie des molécules bioactives spécialité bioactifs et cosmétiques
parfumeur / parfumeuse,"Master pro chimie spécialité formulation, analyse, qualité"
parfumeur / parfumeuse,"Master pro chimie spécialité formulation et évaluation sensorielle des industries des parfums, cosmétique et aromatique alimentaire"
pâtissier / pâtissière,CAP Boulanger
pâtissier / pâtissière,CAP Glacier fabricant
pâtissier / pâtissière,CAP Pâtissier
pâtissier / pâtissière,MC Pâtisserie boulangère
pâtissier / pâtissière,MC Pâtisserie glacerie chocolaterie confiserie spécialisées
pâtissier / pâtissière,BM Pâtissier confiseur glacier traiteur
paysagiste,Diplôme de l'école supérieure d'architecture des jardins
paysagiste,Diplôme d'Etat de paysagiste
paysagiste,Diplôme d'ingénieur de l'Institut supérieur d'agriculture de Lille du Groupe HEI-ISA-ISEN
paysagiste,Diplôme d'ingénieur de l'Institut supérieur d'agriculture de Lille du Groupe HEI-ISA-ISEN spécialité paysage
paysagiste,"Diplôme d'ingénieur de l'Institut supérieur des sciences agronomiques, agroalimentaires, horticoles et du paysage spécialité paysage"
pédiatre,Diplôme d'Etat de docteur en médecine
pédicure-podologue,Diplôme d'Etat de pédicure-podologue
pédologue,"Diplôme d'ingénieur de l'Institut polytechnique de Bordeaux - ENS en environnement, géoressources et ingénierie du développement durable"
pédologue,Diplôme d'ingénieur de l'Institut polytechnique LaSalle Beauvais - ESITPA spécialité sciences de la terre et environnement
pédologue,"Master agrosciences spécialité hydrogéologie, sol et environnement"
pédologue,Master sciences de la Terre et de l'environnement spécialité hydrogéologie et transferts (Hydrogeology and associated transfers)
