accessoiriste,Diplôme de scénographie costumes (ESAD Strasbourg)
accessoiriste,BTS Design de produits
accessoiriste,BTS Design d'espace
accessoiriste,Diplôme arts et techniques du théâtre parcours scénographe
accessoiriste,Diplôme national supérieur des arts décoratifs (ENSAD)
accompagnateur / accompagnatrice de tourisme équestre,Brevet d'aptitude professionnelle d'assistant animateur technicien option loisirs de pleine nature
accompagnateur / accompagnatrice de voyages,BTS Tourisme
accompagnateur / accompagnatrice en moyenne montagne,"Formation qualifiante concertée, métiers sportifs de montagne et de pleine nature"
accompagnateur / accompagnatrice en moyenne montagne,Diplôme d'Etat d'alpinisme-accompagnateur de moyenne montagne
acheteur / acheteuse,Diplôme de l'Ecole Atlantique de commerce et de gestion
acheteur / acheteuse,Licence pro commerce spécialité achats
acheteur / acheteuse,Licence pro gestion des achats et des approvisionnements
acheteur / acheteuse,Responsable achats
acheteur / acheteuse,Responsable des achats
acheteur / acheteuse,Diplôme de l'Ecole supérieure de commerce Kedge Business School
acheteur / acheteuse,Diplôme d'ingénieur de l'École nationale supérieure des mines de Douai
acheteur / acheteuse,Manager achats et supply chain
acheteur / acheteuse,"Master gestion de production, logistique, achats"
acheteur / acheteuse,"Master marketing, vente"
acheteur / acheteuse d'espaces publicitaires,Licence pro e-commerce et marketing numérique
acheteur / acheteuse d'espaces publicitaires,Licence pro métiers du marketing opérationnel
acheteur / acheteuse d'espaces publicitaires,BTS Communication
acheteur / acheteuse d'espaces publicitaires,DUT Information-communication option publicité
acheteur / acheteuse d'espaces publicitaires,"Master marketing, vente"
acheteur / acheteuse d'espaces publicitaires,"Master pro information et communication spécialité marketing, publicité et communication"
actuaire,Diplôme de l'Ecole supérieure des sciences économiques et commerciales (ESSEC)
actuaire,Diplôme de statisticien de l'institut de statistique Paris VI mention actuariat
actuaire,Diplôme d'ingénieur de l'École nationale de la statistique et de l'administration économique du Groupe des écoles nationales d'économie et statistique
actuaire,DU Actuaire
actuaire,Master actuariat
actuaire,Master finance
actuaire,Master mathématiques appliquées
actuaire,"Master mathématiques appliquées, statistique"
actuaire,Master pro mathématiques et applications spécialité actuariat
actuaire,Master pro mathématiques et applications spécialité mathématiques et informatique appliquées
actuaire,Master pro statistique et actuariat appliqués en assurances dommages et santé
administrateur / administratrice de base de données,Chef de projet en systèmes informatiques appliqués
administrateur / administratrice de base de données,Licence pro Métiers de l'informatique : systèmes d'information et gestion des bases de données
administrateur / administratrice de base de données,Responsable de projets informatiques
administrateur / administratrice de base de données,Diplôme d'ingénieur de l'Ecole nationale supérieure de sciences appliquées et de technologie de Lannion de l'université Rennes 1 spécialité informatique
administrateur / administratrice de base de données,Diplôme d'ingénieur de l'Ecole polytechnique de l'université Paris XI spécialité informatique
administrateur / administratrice de base de données,Diplôme d'ingénieur de l'Institut des sciences et techniques des Yvelines de l'université de Versailles Saint-Quentin en Yvelines spécialité informatique
administrateur / administratrice de base de données,Diplôme d'ingénieur de l'Institut d'ingénierie informatique de Limoges
administrateur / administratrice de base de données,"Diplôme d'ingénieur de l'Institut polytechnique de Bordeaux - École nationale supérieure d'électronique, informatique, télécommunications, mathématique et mécanique de Bordeaux spécialité réseaux et systèmes d'information en partenariat avec l'ITII Aquitaine"
administrateur / administratrice de base de données,Diplôme d'ingénieur de l'université de technologie de Compiègne spécialité informatique
administrateur / administratrice de base de données,Expert ingénierie des systèmes et réseaux
administrateur / administratrice de base de données,Manager des systèmes d'information
administrateur / administratrice de base de données,"Manager en ingénierie de l'informatique, des réseaux et des télécommunications"
administrateur / administratrice de base de données,Master informatique spécialité informatique avancée et applications
administrateur / administratrice de base de données,Master informatique spécialité système distribué et réseaux
administrateur / administratrice de base de données,Master informatique spécialité systèmes d'information pour l'aide à la décision
administrateur / administratrice de base de données,Master informatique spécialité systèmes et applications réparties
administrateur / administratrice de biens,Administrateur de biens immobiliers
administrateur / administratrice de biens,Bachelor gestionnaire d'affaires immobilières
administrateur / administratrice de biens,Gestionnaire d'affaires immobilières d'entreprises
administrateur / administratrice de biens,Gestionnaire de biens immobiliers
administrateur / administratrice de biens,Licence pro management des organisations spécialité gestionnaire de l'habitat locatif et de l'habitat social
administrateur / administratrice de biens,BTS Professions immobilières
administrateur / administratrice de biens,DUT Gestion des entreprises et des administrations option gestion comptable et financière
administrateur / administratrice de biens,Mastère spé. Gestion patrimoniale et immobilière
administrateur / administratrice de biens,Mastère spé. Maîtrise d'ouvrage et gestion immobilière
administrateur / administratrice de biens,Certificat d'études juridiques immobilières (ICH)
administrateur / administratrice de biens,Administration de biens
administrateur / administratrice de logiciels de laboratoire,Licence pro métiers de l'informatique : administration et sécurité des systèmes et des réseaux
administrateur / administratrice de logiciels de laboratoire,"Licence pro métiers de l'informatique : conception, développement et test de logiciels"
administrateur / administratrice de logiciels de laboratoire,Licence pro Métiers de l'informatique : systèmes d'information et gestion des bases de données
administrateur / administratrice de logiciels de laboratoire,Diplôme d'ingénieur de l'École d'ingénieurs Denis Diderot de l'université Paris VII spécialité informatique
administrateur / administratrice de logiciels de laboratoire,Diplôme d'ingénieur de l'Ecole nationale supérieure de sciences appliquées et de technologie de Lannion de l'université Rennes 1 spécialité informatique
administrateur / administratrice de logiciels de laboratoire,Diplôme d'ingénieur de l'Ecole nationale supérieure des mines d'Alès spécialité informatique et réseaux
administrateur / administratrice de logiciels de laboratoire,Diplôme d'ingénieur de l'Ecole nationale supérieure d'ingénieurs du Mans de l'université du Mans spécialité informatique
administrateur / administratrice de logiciels de laboratoire,Diplôme d'ingénieur de l'Ecole polytechnique de l'université de Nantes spécialité informatique
administrateur / administratrice de logiciels de laboratoire,Diplôme d'ingénieur de l'École pour l'informatique et les techniques avancées
administrateur / administratrice de logiciels de laboratoire,Master pro informatique spécialité concepteur en architecture des machines et de systèmes informatiques
administrateur / administratrice de logiciels de laboratoire,Master pro informatiques spécialité informatique et systèmes d'information appliqués à la santé
administrateur / administratrice de mission humanitaire,Administrateur de la solidarité internationale
administrateur / administratrice de mission humanitaire,Coordonnateur de projet de solidarité internationale et locale
administrateur / administratrice de mission humanitaire,Manager de projets internationaux
administrateur / administratrice de mission humanitaire,"Master finance, comptabilité, contrôle spécialité finance et contrôle de gestion"
administrateur / administratrice de mission humanitaire,"Master finance, contrôle, comptabilité spécialité contrôle de gestion audit"
administrateur / administratrice de mission humanitaire,"Master sciences du management spécialité comptabilité, contrôle, audit"
administrateur / administratrice de mission humanitaire,Master pro administration des entreprises
administrateur / administratrice de mission humanitaire,"Master pro comptabilité, contrôle spécialité comptabilité, contrôle, audit"
administrateur / administratrice de mission humanitaire,Master pro développement des aptitudes managériales spécialité management et administration des entreprises
administrateur / administratrice de mission humanitaire,"Master pro finance spécialité comptabilité, contrôle, audit"
administrateur / administratrice de mission humanitaire,"Master pro finance spécialité finance, contrôle, diagnostic"
administrateur / administratrice de mission humanitaire,Master pro finance spécialité finance et contrôle de gestion
administrateur / administratrice de mission humanitaire,Master pro sciences du management spécialité administration générale des entreprises
administrateur / administratrice de mission humanitaire,Master pro sciences du management spécialité contrôle de gestion
administrateur / administratrice de spectacle,Licence pro commerce spécialité communication et commercialisation de produits culturels : spectacle vivant
administrateur / administratrice de spectacle,Licence pro management des organisations spécialité administration et gestion des entreprises culturelles
administrateur / administratrice de spectacle,Diplôme arts et techniques du théâtre parcours administrateur du spectacle vivant
administrateur / administratrice de spectacle,"Master administration économique, sociale et culturelle spécialité ingénierie des projets interculturels et internationaux"
administrateur / administratrice de spectacle,Master arts de la scène et du spectacle vivant
administrateur / administratrice de spectacle,Master pro administration des institutions culturelles spécialité administration des institutions culturelles
administrateur / administratrice de spectacle,"Master pro arts, lettres et civilisations spécialité management du spectacle vivant"
administrateur / administratrice de spectacle,"Master pro management de la culture : arts et patrimoine spécialité patrimoine, spectacle vivant et action culturelle"
administrateur / administratrice réseaux,Administrateur systèmes et réseaux
administrateur / administratrice réseaux,Bachelor informatique et réseaux
administrateur / administratrice réseaux,Bachelor informatique option sécurité et réseaux
administrateur / administratrice réseaux,Chef de projet logiciel et réseaux
administrateur / administratrice réseaux,"Diplôme européen d'études supérieures en informatique, réseaux et sécurité"
administrateur / administratrice réseaux,Licence pro métiers de l'informatique : administration et sécurité des systèmes et des réseaux
administrateur / administratrice réseaux,Licence pro métiers des réseaux informatiques et télécommunications
administrateur / administratrice réseaux,Responsable de projets informatiques
administrateur / administratrice réseaux,"BTS Services informatiques aux organisations option A solutions d'infrastructure, systèmes et réseaux"
administrateur / administratrice réseaux,BTS Systèmes numériques option A informatique et réseaux
administrateur / administratrice réseaux,DUT Réseaux et télécommunications
administrateur / administratrice réseaux,Maintenicien(ne) informatique et réseaux
administrateur / administratrice réseaux,Mastère spé. Conception et architecture de réseaux
administrateur / administratrice réseaux,Chef de projet international en informatique et réseaux
administrateur / administratrice réseaux,Diplôme d'ingénieur de l'Ecole polytechnique de l'université Grenoble Alpes spécialité réseaux informatiques et communication multimédia
administrateur / administratrice réseaux,"Diplôme d'ingénieur de l'Institut polytechnique de Bordeaux - École nationale supérieure d'électronique, informatique, télécommunications, mathématique et mécanique de Bordeaux spécialité informatique"
administrateur / administratrice réseaux,"Diplôme d'ingénieur de l'Institut polytechnique de Bordeaux - École nationale supérieure d'électronique, informatique, télécommunications, mathématique et mécanique de Bordeaux spécialité réseaux et systèmes d'information en partenariat avec l'ITII Aquitaine"
administrateur / administratrice réseaux,Diplôme européen en informatique
administrateur / administratrice réseaux,Expert en technologies de l'information (EPITECH)
administrateur / administratrice réseaux,Expert ingénierie des systèmes et réseaux
administrateur / administratrice réseaux,Master informatique spécialité réseaux informatiques et systèmes embarqués
administrateur / administratrice réseaux,Master informatique spécialité système distribué et réseaux
administrateur / administratrice réseaux,Master réseaux et télécommunication
administrateur / administratrice réseaux,Master pro informatique spécialité ingénierie des réseaux
administrateur / administratrice réseaux,Master rech. informatique spécialité réseaux
administrateur / administratrice réseaux,MSc Communication Networks and services
aérodynamicien / aérodynamicienne en aéronautique,"Mastère spé. Ingénierie aéronautique et spatiale, management des applications aéronautiques et spatiales"
aérodynamicien / aérodynamicienne en aéronautique,Diplôme d'ingénieur de l'Ecole nationale de l'aviation civile
aérodynamicien / aérodynamicienne en aéronautique,Diplôme d'ingénieur de l'Ecole nationale supérieure de mécanique et d'aérotechnique de Poitiers
aérodynamicien / aérodynamicienne en aéronautique,Diplôme d'ingénieur de l'Ecole supérieure des techniques aéronautiques et de construction automobile
aérodynamicien / aérodynamicienne en aéronautique,Diplôme d'ingénieur de l'Institut supérieur de l'aéronautique et de l'espace
aérodynamicien / aérodynamicienne en aéronautique,Master aéronautique et espace
aérodynamicien / aérodynamicienne en aéronautique,Master mécanique
agenceur / agenceuse de cuisines et salles de bains,BCP Menuisier-agenceur
agenceur / agenceuse de cuisines et salles de bains,"CAP Menuisier fabricant de menuiserie, mobilier et agencement"
agenceur / agenceuse de cuisines et salles de bains,CAP Menuisier installateur
agenceur / agenceuse de cuisines et salles de bains,BTS Développement et réalisation bois
agenceur / agenceuse de cuisines et salles de bains,BTS Etude et réalisation d'agencement
agenceur / agenceuse de cuisines et salles de bains,BTS Systèmes constructifs bois et habitat
agent / agente artistique,Licence pro activités culturelles et artistiques spécialité conception et mise en oeuvre de projets culturels
agent / agente artistique,Licence pro gestion de projets et structures artistiques et culturels
agent / agente artistique,Master direction de projets ou établissements culturels
agent / agente artistique,Master management de la culture : arts et patrimoine spécialité direction de projets dans les nouvelles filières culturelles
agent / agente de développement des énergies renouvelables,Licence pro gestion et maintenance des installations énergétiques
agent / agente de développement des énergies renouvelables,"Licence pro maintenance des systèmes industriels, de production et d'énergie"
agent / agente de développement des énergies renouvelables,"Licence pro maîtrise de l'énergie, électricité, développement durable"
agent / agente de développement des énergies renouvelables,Licence pro métiers de l'électricité et de l'énergie
agent / agente de développement des énergies renouvelables,"Licence pro métiers de l'énergétique, de l'environnement et du génie climatique"
agent / agente de développement des énergies renouvelables,Licence pro métiers du BTP : performance énergétique et environnementale des bâtiments
agent / agente de développement des énergies renouvelables,BTS Maintenance des systèmes option C systèmes éoliens
agent / agente de développement des énergies renouvelables,DUT Génie civil - construction durable
agent / agente de développement des énergies renouvelables,DUT Génie thermique et énergie
agent / agente de développement des énergies renouvelables,Mastère spé. Nouvelles technologies de l'énergie
agent / agente de développement des énergies renouvelables,DHET Nouvelles technologies de l'énergie (niveau I)
agent / agente de développement des énergies renouvelables,"Master énergétique, thermique"
agent / agente de développement des énergies renouvelables,Master énergie
agent / agente de développement local,Licence administration économique et sociale
agent / agente de développement local,Licence pro développement de projets de territoires
agent / agente de développement local,Master gestion des territoires et développement local
agent / agente de développement touristique,"Master stratégie du développement culturel spécialité médiations de la culture et des patrimoines (MUSEOCOM) expositions, cultures numériques, tourismes"
agent / agente de développement touristique,Master tourisme
agent / agente de développement touristique,Master urbanisme et aménagement
agent / agente de développement touristique,Master pro développement des territoires et nouvelles ruralités spécialité tourisme et valorisation des territoires
agent / agente de développement touristique,Master pro économie appliquée spécialité développement des territoires
agent / agente de développement touristique,"Master pro identités, patrimoines, histoire spécialité développement de projets en tourisme culturel"
agent / agente de développement touristique,Master pro management spécialité management de l'art et tourisme culturel
agent / agente de développement touristique,Master pro tourisme spécialité management du tourisme durable
agent / agente de propreté et d'hygiène,Responsable de service hygiène propreté
agent / agente de propreté et d'hygiène,CAP Agent de propreté et d'hygiène
agent / agente de propreté et d'hygiène,BTS Métiers des services à l'environnement
agent / agente de sécurité,CAP Agent de sécurité
agent / agente de sécurité,MC Sûreté des espaces ouverts au public
agent / agente de sécurité,DUT Hygiène sécurité environnement
agent / agente de sûreté ferroviaire,CAP Agent de sécurité
agent / agente de transit,Licence pro logistique et transports internationaux
agent / agente de transit,BTS Transport et prestations logistiques
agent / agente de transit,DUT Gestion logistique et transport
agent général / agente générale d'assurances,"Licence pro assurance, banque, finance spécialité assurance"
agent général / agente générale d'assurances,"Licence pro assurance, banque, finance spécialité commercialisation des produits bancaires et d'assurance"
agent général / agente générale d'assurances,"Licence pro assurance, banque, finance spécialité conseils en assurances et services financiers"
agent général / agente générale d'assurances,BTS Assurance
agent général / agente générale d'assurances,BTS Management des unités commerciales
agent général / agente générale d'assurances,BTS Négociation et relation client
agent général / agente générale d'assurances,DEUST Banque organismes financiers et de prévoyance
agent général / agente générale d'assurances,DUT Carrières juridiques
agent général / agente générale d'assurances,DUT Techniques de commercialisation
agent général / agente générale d'assurances,Master pro droit des affaires spécialité assurance et banque
agent général / agente générale d'assurances,"Master pro droit patrimonial, immobilier et notarial spécialité droit et métiers des assurances"
agent général / agente générale d'assurances,"Master pro monnaie, banque, finance, assurance spécialité banque, finance, assurance"
agent hydrothermal / agente hydrothermale,FCIL Agent hydro-thermal
agent hydrothermal / agente hydrothermale,DU Pratique des soins en hydrothérapie
agent hydrothermal / agente hydrothermale,Pratique de soins en hydrothérapie et remise en forme
agent immobilier / agente immobilière,Bachelor gestionnaire d'affaires immobilières
agent immobilier / agente immobilière,Licence pro management des organisations spécialité gestionnaire de l'habitat locatif et de l'habitat social
agent immobilier / agente immobilière,Négociateur immobilier
agent immobilier / agente immobilière,BTS Professions immobilières
agriculteur / agricultrice,BTSA Agronomie : productions végétales
agriculteur / agricultrice,"BTSA Analyse, conduite et stratégie de l'entreprise agricole"
agriculteur / agricultrice,BTSA Productions animales
agriculteur / agricultrice,CS Conduite de productions en agriculture biologique et commercialisation
agronome,Diplôme d'ingénieur spécialisé en innovations dans les systèmes agricoles et agroalimentaires du monde de l'Institu national d'études supérieures agronomiques de Montpellier
agronome,Diplôme d'ingénieur de l'Ecole nationale supérieure agronomique de Toulouse de l'INP de Toulouse
agronome,Diplôme d'ingénieur de l'Ecole nationale supérieure d'agronomie et des industries alimentaires de l'université de Lorraine spécialité agronomie
agronome,Diplôme d'ingénieur de l'École nationale supérieure des sciences agronomiques de Bordeaux Aquitaine
agronome,Diplôme d'ingénieur de l'Institut des sciences et industries du vivant et de l'environnement (AgroParisTech)
agronome,Diplôme d'ingénieur de l'Institut polytechnique LaSalle Beauvais - ESITPA spécialité agronomie et agro-industries
agronome,"Diplôme d'ingénieur de l'Institut supérieur des sciences agronomiques, agroalimentaires, horticoles et du paysage spécialité agronomie"
agronome,"Master biologie, agrosciences"
aide médico-psychologique,Diplôme d'Etat d'accompagnant éducatif et social spécialité accompagnement de la vie en structure collective
aide médico-psychologique,Diplôme d'Etat d'aide médico-psychologique (dernière session d'examen en 2016)
ajusteur-monteur / ajusteuse-monteuse,DUT Génie mécanique et productique
ajusteur-monteur / ajusteuse-monteuse,MC Maquettes et prototypes
analyste de crédit,Mastère spé. Banque et ingénierie financière
analyste de crédit,Mastère spé. Techniques financières
analyste de crédit,"Master droit de l'entreprise spécialité secteur financier (banque, assurance, finance)"
analyste de crédit,Master finance
analyste de crédit,Master finance spécialité stratégie et finance d'entreprise en Europe
analyste de crédit,"Master pro finance, comptabilité, contrôle de gestion spécialité gestion des risques"
analyste de crédit,"Master pro monnaie, banque, finance, assurance spécialité banque, finance, gestion des risques"
analyste financier / financière,Mastère spé. Analyse financière internationale
analyste financier / financière,Mastère spé. Banque et ingénierie financière
analyste financier / financière,Mastère spé. Techniques financières
analyste financier / financière,Analyse financière
analyste financier / financière,Magistère Economie et finance internationales
analyste financier / financière,Manager des organisations à l'international
analyste financier / financière,Master finance
analyste financier / financière,Master finance spécialité stratégie et finance d'entreprise en Europe
analyste financier / financière,"Master pro comptabilité, finance, fiscalité et patrimoine spécialité finance - entreprise et marchés"
analyste financier / financière,"Master pro finance, comptabilité, contrôle de gestion spécialité analyse et stratégie financière"
analyste financier / financière,Master pro ingénierie économique et statistique spécialité ingénierie économique
anatomiste,Diplôme d'Etat de docteur en médecine
anatomiste,Diplôme d'études spécialisées vétérinaires (DESV) en anatomie pathologie vétérinaire
anesthésiste-réanimateur / anesthésiste-réanimatrice,Diplôme d'Etat de docteur en médecine
animateur / animatrice 2D et 3D,"Animation et réalisation 3D options game design, réalisateur"
animateur / animatrice 2D et 3D,Animation 3D cinéma numérique
animateur / animatrice 2D et 3D,Bachelor Animation & 3D
animateur / animatrice 2D et 3D,Bachelor animation conception 3D et effets visuels
animateur / animatrice 2D et 3D,"Bachelor animation, 2D/3D, illustration jeux vidéo, effets spéciaux"
animateur / animatrice 2D et 3D,"Bachelor animation, 3D et jeux vidéo"
animateur / animatrice 2D et 3D,Bachelor arts numériques animation 2D/3D et jeu vidéo
animateur / animatrice 2D et 3D,Bachelor in Video Game Art
animateur / animatrice 2D et 3D,Certificat d'école en animation 2D
animateur / animatrice 2D et 3D,Cinéma d'animation et effets spéciaux 3 D
animateur / animatrice 2D et 3D,Cinéma d'animation 2D/3D
animateur / animatrice 2D et 3D,Cinématique
