éducateur sportif / éducatrice sportive des activités aquatiques et de la natation,"DEUST Sciences, technologies, santé mention animation et gestion des activités sportives et culturelles"
éducateur sportif / éducatrice sportive des activités aquatiques et de la natation,"Diplôme d'Etat de la jeunesse, de l'éducation populaire et du sport spécialité perfectionnement sportif"
éducateur technique spécialisé / éducatrice technique spécialisée,Diplôme d'Etat d'éducateur technique spécialisé
électricien installateur / électricienne installatrice,BCP Installateur en équipements électriques
électricien installateur / électricienne installatrice,CAP Préparation et réalisation d'ouvrages électriques
électricien installateur / électricienne installatrice,Responsable de chantier en installation électrique
électricien installateur / électricienne installatrice,MC Technicien en énergies renouvelables option A : énergie électrique
électromécanicien / électromécanicienne,Licence pro métiers de l'électricité et de l'énergie
électromécanicien / électromécanicienne,CAP Transports par câbles et remontées mécaniques
électromécanicien / électromécanicienne,MC Maintenance des systèmes embarqués de l'automobile
électromécanicien / électromécanicienne,BTS Conception et réalisation de systèmes automatiques
électromécanicien / électromécanicienne,BTS Electrotechnique
électromécanicien / électromécanicienne en remontées mécaniques,BTS Conception et réalisation de systèmes automatiques
électromécanicien / électromécanicienne en remontées mécaniques,BTS Electrotechnique
électromécanicien / électromécanicienne en remontées mécaniques,DUT Génie électrique et informatique industrielle
électronicien / électronicienne automobile,"Licence pro maintenance et technologie : électronique, instrumentation"
électronicien / électronicienne automobile,Licence pro maintenance et technologie : organisation de la maintenance
électronicien / électronicienne automobile,Licence pro maintenance et technologie : systèmes pluritechniques
électronicien / électronicienne automobile,"Licence pro métiers de l'électronique : communication, systèmes embarqués"
électronicien / électronicienne automobile,"Licence pro organisation, management des services de l'automobile"
électronicien / électronicienne automobile,FCIL Maintenance de véhicules électriques ou hybrides
électronicien / électronicienne automobile,MC Maintenance des systèmes embarqués de l'automobile
éleveur / éleveuse,BPA Travaux de la production animale
éleveur / éleveuse,BPA Travaux de l'élevage canin et félin
éleveur / éleveuse,CAP agricole Agricultures des régions chaudes
éleveur / éleveuse,CAP agricole Métiers de l'agriculture
éleveur / éleveuse,"BTSA Analyse, conduite et stratégie de l'entreprise agricole"
éleveur / éleveuse,BTSA Productions animales
éleveur / éleveuse,CS Conduite de l'élevage laitier
éleveur / éleveuse,CS Conduite de l'élevage ovin viande
éleveur / éleveuse,CS Conduite de l'élevage porcin
éleveur / éleveuse,CS Conduite d'un élevage avicole et commercialisation des produits
éleveur / éleveuse,CS Conduite d'un élevage caprin et commercialisation des produits
employé / employée de pressing,CAP Métier du pressing
employé / employée de pressing,CAP Métiers de la blanchisserie
employé / employée de restaurant,CAP Restaurant
enquêteur privé / enquêtrice privée,Licence pro agent de recherches privées
enquêteur privé / enquêtrice privée,"Licence pro sécurité des biens et des personnes spécialité activité juridique, directeur d'enquêtes privées"
enseignant / enseignante d'art,"Master métiers de l'enseignement, de l'éducation et de la formation-second degré (en ALL)"
enseignant / enseignante de la conduite automobile et de la sécurité routière,Enseignant(e) de la conduite et de la sécurité routière
enseignant / enseignante humanitaire,"Master didactique des langues spécialité illettrismes, interculturalité et FLE/FLS"
enseignant / enseignante humanitaire,Master français langue étrangère spécialité analyse des discours et didactique du FLE/FLES
enseignant / enseignante humanitaire,Master linguistique spécialité didactique des langues et FLE et seconde
enseignant / enseignante humanitaire,"Master métiers de l'enseignement, de l'éducation et de la formation - premier degré"
enseignant / enseignante humanitaire,"Master métiers de l'enseignement, de l'éducation et de la formation-second degré (en SHS)"
enseignant / enseignante humanitaire,Master sciences du langage spécialité apprentissage et didactique du français langues étrangères et seconde
enseignant / enseignante humanitaire,"Master pro arts, lettres et civilisations spécialité français langue étrangère"
enseignant / enseignante humanitaire,Master pro linguistique spécialité diffusion du français
enseignant / enseignante humanitaire,Master pro sciences du langage spécialité didactique des langues et des cultures - français langue étrangère et seconde (FLES)
entraîneur / entraîneuse de chevaux,CAP agricole Lad - cavalier d'entraînement
ergonome,"Master psychologie sociale, du travail et des organisations"
ergonome,Master STAPS : ingénierie et ergonomie de l'activité physique
ergothérapeute,Diplôme d'Etat d'ergothérapeute
esthéticien-cosméticien / esthéticienne-cosméticienne,"CAP Esthétique, cosmétique, parfumerie"
esthéticien-cosméticien / esthéticienne-cosméticienne,BM Esthéticienne cosméticienne
esthéticien-cosméticien / esthéticienne-cosméticienne,BTS Métiers de l'esthétique-cosmétique-parfumerie option A : management
étalagiste,BTS Design de communication espace et volume
étalagiste,BTS Design d'espace
étanchéiste,CAP Etancheur du bâtiment et des travaux publics
étanchéiste,BTS Enveloppe des bâtiments : conception et réalisation
ethnologue,Diplôme de l'EHESS
ethnologue,Master anthropologie
ethnologue,Master ethnologie
ethnologue,Master sciences sociales
expert / experte automobile,FCIL Maintenance de véhicules électriques ou hybrides
expert / experte automobile,Diplôme d'expert en automobile
expert / experte en sécurité informatique,Chef de projet logiciel et réseaux
expert / experte en sécurité informatique,"Diplôme européen d'études supérieures en informatique, réseaux et sécurité"
expert / experte en sécurité informatique,Diplôme d'ingénieur spécialisé en sécurité pour les systèmes informatiques et les communications
expert / experte en sécurité informatique,Chef de projet sécurité des systèmes d'information
expert / experte en sécurité informatique,Diplôme d'ingénieur de l'Ecole nationale supérieure d'ingénieurs de Bretagne Sud de l'université de Bretagne Sud spécialité sécurité des systèmes d'information en partenariat avec l'ITII Bretagne
expert / experte en sécurité informatique,Diplôme d'ingénieur de l'Ecole nationale supérieure d'ingénieurs de Caen spécialité informatique
expert / experte en sécurité informatique,Diplôme d'ingénieur de l'Ecole supérieure d'informatique électronique automatique
expert / experte en sécurité informatique,Diplôme d'ingénieur de l'Institut d'ingénierie informatique de Limoges
expert / experte en sécurité informatique,Diplôme d'ingénieur de l'Institut Mines-Télécom - Télécom ParisTech
expert / experte en sécurité informatique,Diplôme d'ingénieur de l'Institut national des sciences appliquées Centre Val de Loire spécialité sécurité et technologies informatiques
expert / experte en sécurité informatique,Diplôme d'ingénieur de l'université de technologie de Troyes spécialité réseaux et télécommunications
expert / experte en sécurité informatique,Diplôme d'ingénieur de Télécom Bretagne de l'Institut Mines-Télécom
expert / experte en sécurité informatique,Diplôme d'ingénieur de Télécom Bretagne de l'Institut Mines-Télécom spécialité réseaux et télécommunications en partenariat avec l'ITII Bretagne
expert / experte en sécurité informatique,Diplôme d'ingénieur de Télécom Sud Paris de l'Institut Mines-Télécom
expert / experte en sécurité informatique,Diplôme européen en informatique
expert / experte en sécurité informatique,Expert en technologies de l'information (EPITECH)
expert / experte en sécurité informatique,Expert ingénierie des systèmes et réseaux
expert / experte en sécurité informatique,Manager en ingénierie informatique
expert / experte en sécurité informatique,Master gestion des risques spécialité management des risques et des systèmes d'information
expert / experte en sécurité informatique,Master informatique spécialité conception et développement de logiciels sûrs
expert / experte en sécurité informatique,Master mathématiques et applications spécialité calcul scientifique et mathématiques de l'information
expert / experte en sécurité informatique,"Master mathématiques et applications spécialité mathématiques de l'information, cryptographie"
expert / experte en sécurité informatique,"Master mathématiques, informatique spécialité sécurité, cryptologie et codage de l'information"
expert / experte en sécurité informatique,Master sciences et techniques de l'information et de la communication spécialité sécurité de l'information et cryptologie
expert / experte en sécurité informatique,Master sécurité des systèmes informatiques
expert / experte en sécurité informatique,"Master pro informatique, génie de l'information et des systèmes spécialité sécurité des systèmes informatiques"
expert /experte bilan carbone,Diplôme d'ingénieur de l'Ecole des métiers de l'environnement
expert /experte bilan carbone,Diplôme d'ingénieur de l'Ecole nationale du génie de l'eau et de l'environnement de Strasbourg
expert /experte bilan carbone,"Diplôme d'ingénieur de l'Ecole polytechnique universitaire de Savoie de l'université de Chambéry spécialité environnement, bâtiment, énergie (EBE)"
expert /experte bilan carbone,"Master économie de l'environnement, de l'énergie et des transports"
expert /experte bilan carbone,Master énergie spécialité ingénierie thermique et énergie
expert /experte bilan carbone,Master risques et environnement
expert /experte bilan carbone,Master sciences de l'environnement
expert /experte bilan carbone,Master sciences des matériaux spécialité matériaux pour les énergies renouvelables
expert /experte bilan carbone,Master sciences pour l'ingénieur spécialité gestion de l'énergie
expert /experte bilan carbone,"Master pro droit des affaires spécialité environnement, sécurité et qualité de l'entreprise"
expert /experte bilan carbone,Master pro risques et environnement spécialité ingénierie environnementale et énergies nouvelles
expert /experte bilan carbone,Master pro sciences de la Terre et de l'environnement spécialité gestion de l'environnement et du développement durable
expert immobilier / experte immobilier,"Mastère spé. Immobilier, bâtiment et énergie"
expert immobilier / experte immobilier,Certificat d'études juridiques immobilières (ICH)
expert immobilier / experte immobilier,Administration de biens
expert immobilier / experte immobilier,Manager des actifs immobiliers
expert immobilier / experte immobilier,"Master pro droit patrimonial, immobilier et notarial spécialité droit et métiers de l'urbanisme"
façadier / façadière,CAP Maçon
façadier / façadière,CAP Peintre-applicateur de revêtements
façadier / façadière,CAP Plâtrier - plaquiste
façadier / façadière,Façadier peintre
façadier / façadière,BTS Enveloppe des bâtiments : conception et réalisation
façonnier / façonnière des industries graphiques,CAP Arts de la reliure
facteur/ factrice d'instruments,CAP Accordeur de piano
facteur/ factrice d'instruments,CAP Assistant technique en instruments de musique option accordéon
facteur/ factrice d'instruments,CAP Assistant technique en instruments de musique option guitare
facteur/ factrice d'instruments,CAP Assistant technique en instruments de musique option instruments à vent
facteur/ factrice d'instruments,CAP Assistant technique en instruments de musique option piano
facteur/ factrice d'instruments,CAP Lutherie
facteur/ factrice d'instruments,CAP Ouvrier archetier
facteur/ factrice d'instruments,DMA Lutherie
ferronnier / ferronnière d'art,CAP Ferronnier d'art
ferronnier / ferronnière d'art,DMA Décor architectural option métal
fiscaliste,Certificat d'aptitude à la profession d'avocat
fiscaliste,"Diplôme de responsable marketing, finance et commerce international (ECE)"
fiscaliste,Diplôme d'études supérieures européennes de management
fiscaliste,Diplôme d'Audencia Nantes programme grande école
fiscaliste,Diplôme de juriste conseil d'entreprise
fiscaliste,Diplôme de l'Ecole de management de Normandie
fiscaliste,Diplôme de l'Ecole multinationale des affaires
fiscaliste,Diplôme de l'Ecole supérieure de commerce de Dijon
fiscaliste,Diplôme EDC Paris Business School
fiscaliste,Master droit de l'entreprise spécialité droit de l'entreprise et des affaires - DJCE
fiscaliste,Master droit des affaires spécialité juriste et conseil d'entreprise - DJCE
fiscaliste,Master droit public spécialité droit fiscal
fiscaliste,"Master pro comptabilité, finance, fiscalité et patrimoine spécialité contrôle audit conseil"
fiscaliste,Master pro droit des affaires spécialité droit de l'entreprise et des affaires et du juriste conseil d'entreprise
fiscaliste,Master pro droit des affaires spécialité droit des affaires et de l'entreprise - DJCE
fiscaliste,Master pro droit des affaires spécialité droit fiscal des affaires
fiscaliste,Master pro droit des affaires spécialité fiscalité internationale
fiscaliste,Master pro droit public spécialité fiscalité internationale
fiscaliste,Master pro droit public spécialité stratégie fiscale de l'entreprise
fiscaliste,Master pro droit spécialité droit de l'entreprise et des affaires - DJCE
fiscaliste,"Master pro finance, comptabilité spécialité gestion fiscale"
fiscaliste,Master rech. droit public spécialité finances publiques et fiscalité
fleuriste,CAP Fleuriste
fleuriste,BM Fleuriste
formateur / formatrice d'adultes,Licence pro gestion et accompagnement de projets pédagogiques
formateur / formatrice d'adultes,"Master métiers de l'enseignement, de l'éducation et de la formation-pratiques et ingénierie de la formation"
formateur / formatrice en informatique,"Licence pro métiers de la GRH : formation, compétences et emploi"
formateur / formatrice en informatique,Licence pro métiers de la médiation scientifique et technique
formateur / formatrice en informatique,"Master pro information et communication spécialité applications informatiques : gestion, éducation aux médias, E-formation"
formateur / formatrice en informatique,Master pro informatique spécialité génie informatique
formateur / formatrice en informatique,Master pro informatique spécialité informatiques appliquées à la gestion des entreprises : MIAGE
formateur / formatrice en informatique,Master pro informatique spécialité méthodes informatiques et technologies de l'information et de la communication
formateur / formatrice en informatique,Master pro méthodes informatiques appliquées à la gestion des entreprises spécialité méthodes informatiques appliquées à la gestion des entreprises (MIAGE)
formulateur / formulatrice,Licence pro biotechnologies spécialité développement des produits cosmétiques et de santé
formulateur / formulatrice,Licence pro industries chimiques et pharmaceutiques spécialité formulation cosmétique
formulateur / formulatrice,Licence pro industries chimiques et pharmaceutiques spécialité produits de santé et cosmétiques
formulateur / formulatrice,Licence pro santé spécialité cosmétologie
formulateur / formulatrice,BTS Bioanalyses et contrôles
formulateur / formulatrice,DUT Chimie option chimie analytique et de synthèse
garçon de café,CAP Restaurant
garçon de café,CAP Services en brasserie-café
garçon de café,MC Employé barman
garçon de café,MC Sommellerie
"garde (chasse, pêche, littoral, rivière, parcs nationaux)",BTSA Gestion et maîtrise de l'eau
"garde (chasse, pêche, littoral, rivière, parcs nationaux)",BTSA Gestion et protection de la nature
garde à cheval,Formation de garde à cheval
garde à cheval,CAP Agent de sécurité
généticien / généticienne,Diplôme d'Etat de docteur en médecine
généticien / généticienne,Diplôme d'ingénieur de l'Ecole polytechnique de l'université de Nice spécialité génie biologique
généticien / généticienne,Diplôme d'ingénieur de l'École polytechnique universitaire de Marseille de l'université d'Aix-Marseille spécialité génie biologique
généticien / généticienne,Diplôme d'ingénieur de l'Institut polytechnique de Bordeaux - École nationale supérieure de technologie des biomolécules de Bordeaux
généticien / généticienne,Master biologie moléculaire et cellulaire spécialité génétique
généticien / généticienne,Master pro pathologie humaine spécialité conseil en génétique et en médecine prédictive
généticien / généticienne,Master rech. génétique
généticien / généticienne,Master rech. pathologie humaine spécialité génétique humaine et médicale
généticien / généticienne,Master rech. sciences de la vie et de la santé spécialité génétique et physiologie recherche
généticien / généticienne,"Master rech. sciences de la vie et de la santé spécialité génétique, immunité et développement animal ou végétal"
géochimiste,Diplôme d'ingénieur de l'Ecole nationale supérieure de chimie de Lille
géochimiste,Diplôme d'ingénieur de l'Ecole nationale supérieure de chimie de Montpellier
géochimiste,Diplôme d'ingénieur de l'Ecole nationale supérieure de chimie de Paris
géochimiste,Diplôme d'ingénieur de l'Ecole polytechnique universitaire Pierre et Marie Curie de l'université Paris VI spécialité sciences de la Terre
géochimiste,Diplôme d'ingénieur de l'Ecole supérieure de chimie physique électronique de Lyon spécialité chimie-génie des procédés
géochimiste,"Master sciences de la Terre et de l'environnement spécialité H3 : hydrogéologie, hydrobiogéochimie, hydropédologie"
géochimiste,"Master sciences de la Terre et des planètes, environnement"
géochimiste,Master pro géologie appliquée spécialité géologie appliquée
géographe,"Licence pro cartographie, topographie et systèmes d'information géographique"
géographe,Licence pro développement de projets de territoires
géographe,Licence pro métiers de l'aménagement du territoire et de l'urbanisme
géographe,Diplôme d'ingénieur de l'Ecole nationale des sciences géographiques
géographe,Master géographie
géographe,"Master géographie, aménagement, environnement et développement"
géographe,Master géomatique
géologue,Diplôme d'ingénieur de l'Ecole et observatoire des sciences de la Terre de l'université Strasbourg
géologue,Diplôme d'ingénieur de l'Ecole nationale supérieure de géologie de l'université de Lorraine
géologue,Diplôme d'ingénieur de l'Ecole nationale supérieure des mines d'Alès
géologue,Diplôme d'ingénieur de l'Ecole nationale supérieure des mines de Paris
géologue,Diplôme d'ingénieur de l'Ecole nationale supérieure du pétrole et des moteurs spécialité géosciences pétrolières
géologue,Diplôme d'ingénieur de l'Ecole polytechnique de l'université Grenoble Alpes spécialité géotechnique et génie civil
géologue,Diplôme d'ingénieur de l'Ecole polytechnique universitaire Pierre et Marie Curie de l'université Paris VI spécialité sciences de la Terre
géologue,Diplôme d'ingénieur de l'Institut national des sciences appliquées de Strasbourg spécialité topographie
géologue,"Diplôme d'ingénieur de l'Institut polytechnique de Bordeaux - ENS en environnement, géoressources et ingénierie du développement durable"
géologue,Diplôme d'ingénieur de l'Institut polytechnique LaSalle Beauvais - ESITPA spécialité sciences de la terre et environnement
géologue,"Master sciences de la Terre et des planètes, environnement"
géologue,Master pro géologie appliquée spécialité géologie appliquée
géologue,Master pro sciences de la Terre spécialité géologie de l'aménagement
géologue,Master rech. génie civil spécialité matériaux et structures dans leur environnement
géologue minier / minière,Diplôme d'ingénieur de l'Ecole et observatoire des sciences de la Terre de l'université Strasbourg
géologue minier / minière,Diplôme d'ingénieur de l'Ecole nationale supérieure de géologie de l'université de Lorraine
géologue minier / minière,Diplôme d'ingénieur de l'Ecole polytechnique universitaire Pierre et Marie Curie de l'université Paris VI spécialité sciences de la Terre
géologue minier / minière,Diplôme d'ingénieur de l'Institut polytechnique LaSalle Beauvais - ESITPA spécialité sciences de la terre et environnement
géologue minier / minière,"Master sciences de la Terre et des planètes, environnement"
géologue modélisateur / modélisatrice,Diplôme d'ingénieur de l'Ecole et observatoire des sciences de la Terre de l'université Strasbourg
géologue modélisateur / modélisatrice,Diplôme d'ingénieur de l'Ecole nationale supérieure de géologie de l'université de Lorraine
géologue modélisateur / modélisatrice,Diplôme d'ingénieur de l'Ecole nationale supérieure des mines de Nancy de l'université de Lorraine
géologue modélisateur / modélisatrice,"Diplôme d'ingénieur de l'Institut polytechnique de Bordeaux - ENS en environnement, géoressources et ingénierie du développement durable"
géologue modélisateur / modélisatrice,Diplôme d'ingénieur de l'Institut polytechnique LaSalle Beauvais - ESITPA spécialité sciences de la terre et environnement
géologue modélisateur / modélisatrice,"Master sciences de la Terre et de l'environnement spécialité science de la terre : géophysique, géologie et dynamique des systèmes terrestres"
géologue modélisateur / modélisatrice,"Master sciences de la Terre et des planètes, environnement"
géologue modélisateur / modélisatrice,Master pro géologie appliquée spécialité géologie appliquée
géomaticien / géomaticienne,Diplôme de technicien supérieur professionnel spécialité géologie et environnement
géomaticien / géomaticienne,Licence sciences de la terre
géomaticien / géomaticienne,Licence sciences de la vie et de la terre
géomaticien / géomaticienne,"Licence pro cartographie, topographie et systèmes d'information géographique"
géomaticien / géomaticienne,Licence pro métiers de l'aménagement du territoire et de l'urbanisme
géomaticien / géomaticienne,BTS Métiers du géomètre-topographe et de la modélisation numérique
géomaticien / géomaticienne,Chargé (e) de projet en aménagement durable des territoires (ENTE)
géomaticien / géomaticienne,Formation de technicien supérieur du développement durable (ENTE)
géomaticien / géomaticienne,Diplôme d'ingénieur de l'université de Marne-la-Vallée spécialité informatique et géomatique
géomaticien / géomaticienne,Master géographie
géomaticien / géomaticienne,"Master géographie, aménagement, environnement et développement"
géomaticien / géomaticienne,Master géomatique
géomètre-topographe,BTS Métiers du géomètre-topographe et de la modélisation numérique
géomètre-topographe,Diplôme d'ingénieur de l'Ecole spéciale des travaux publics du bâtiment et de l'industrie spécialité topographie
géomètre-topographe,Diplôme d'ingénieur de l'Institut national des sciences appliquées de Strasbourg spécialité topographie
géomètre-topographe,Diplôme d'ingénieur du Conservatoire national des arts et métiers spécialité géomètre et topographe
géophysicien / géophysicienne,Diplôme d'ingénieur de l'Ecole d'ingénieurs de l'université de Toulon
géophysicien / géophysicienne,Diplôme d'ingénieur de l'Ecole nationale supérieure du pétrole et des moteurs spécialité géosciences pétrolières
géophysicien / géophysicienne,Diplôme d'ingénieur de l'Ecole polytechnique de l'université Grenoble Alpes spécialité géotechnique et génie civil
géophysicien / géophysicienne,Diplôme d'ingénieur de l'Ecole polytechnique universitaire Pierre et Marie Curie de l'université Paris VI spécialité sciences de la Terre
géophysicien / géophysicienne,"Master géoressources, géorisques, géotechnique"
géophysicien / géophysicienne,"Master sciences de la Terre et de l'environnement spécialité H3 : hydrogéologie, hydrobiogéochimie, hydropédologie"
géophysicien / géophysicienne,"Master sciences de la Terre et des planètes, environnement spécialité géophysique"
géophysicien / géophysicienne,"Master pro géoressources, géorisques, géotechnique spécialité géophysique de surface et subsurface"
géotechnicien / géotechnicienne,Licence sciences de la terre
géotechnicien / géotechnicienne,Licence sciences de la vie et de la terre
géotechnicien / géotechnicienne,Licence pro protection de l'environnement spécialité géologie de l'aménagement
géotechnicien / géotechnicienne,Licence pro travaux publics spécialité technicien en géo-mesures et foncier
géotechnicien / géotechnicienne,BTS Géologie appliquée
géotechnicien / géotechnicienne,BTS Métiers du géomètre-topographe et de la modélisation numérique
